Tournament,Round,Title,Lead
"DTU PD 2021","1","Novice Finals","THW allow companies to buy the rights to govern economically failing cities."
"DTU PD 2021","2","Novice Semifinals","TH, as new immigrants, Would prioritise the preservation of their traditional culture in the household over assimilating to the new culture"
"DTU PD 2021","3","Grand Final","THP expositional storytelling in fiction, over interpretative storytelling."
"DTU PD 2021","4","Semifinals","Assuming free consent was given, THW permits people to participate in the Octopus Game."
"DTU PD 2021","5","Quarterfinals","TH as the US would ease the sanctions imposed on Venezuela."
"DTU PD 2021","6","Round 5","THBT public universities should consider the political beliefs of professors in hiring and tenure decisions in order to ensure ideological representation."
"DTU PD 2021","7","Round 4","THBT copyright has done more harm than good for artists."
"DTU PD 2021","8","Round 3","THBT feminist groups should refrain from claiming that women who oppose feminism are operating under false consciousness."
"DTU PD 2021","9","Round 2","In emerging democracies, THW cap the maximum number of seats in a parliament that a political party can get."
"DTU PD 2021","10","Round 1","THBT Indian players opting to primarily play in the IPL has done more harm than good for the Indian nation cricketing team."
"Duke Open 2022","1","Grand Final","THS the rise of AI that is able to accurately understand and replicate human emotions"
"Duke Open 2022","2","Semifinals","THR that South Africa did not try the leaders responsible for Apartheid for crimes against humanity"
"Duke Open 2022","3","Novice Finals","THS an automation tax"
"Duke Open 2022","4","Round 5","Assuming secure implementation and easy use, THW implement liquid democracy"
"Duke Open 2022","5","Round 4","THBT conservation groups should use appealing features of animals (e.g. their cuteness, their cultural significance etc.) to argue for their protection, rather than focussing exclusively on on arguing for the protection of species with inherent or ecological value"
"Duke Open 2022","6","Round 3","This House Supports job security legislation"
"Duke Open 2022","7","Round 2","THW remove all professional licensing requirements (e.g. to practice as a doctor, lawyer, in some trades etc.)"
"Duke Open 2022","8","Round 1","THS the deregulation of the medical research sector/industry in times of health crises."
"Durham IV 2023","1","Grand Final","THP a world where children are raised communally"
"Durham IV 2023","2","ProAm Final","THP a decriminalised to legalised model of prostitution"
"Durham IV 2023","3","Semifinals","TH predicts that the proportion of people in the UK identifying as religious will be greater in 2060 than it is today"
"Durham IV 2023","4","Round 5","THBT the institutionalization of art has done more harm than good"
"Durham IV 2023","5","Round 4","THBT the Scottish government should prioritise teaching Gaelic in schools over modern langauges (eg French, Mandarin, German)"
"Durham IV 2023","6","Round 3","THS policies of debt monetisation in times of significant crisis and economic downturn (eg the Covid-19 pandemic, wars)"
"Durham IV 2023","7","Round 2","THW ban saviour siblings"
"Durham IV 2023","8","Round 1","THP a world with a dominant norm of spiritual fluidity"
"Durham IV 2024","1","Grand Final","This House Would Not Wear the Poppy"
"Durham IV 2024","2","Semifinals","Assuming feasibility, This House as California would Secede from the United States"
"Durham IV 2024","3","Novice Final","This House Would Leave Carthage"
"Durham IV 2024","4","Round 5","This House Believes That it is in the interests of the Chinese population to fully remove all restrictions on immigration"
"Durham IV 2024","5","Round 4","This House Regrets the Romanticisation of Pregnancy"
"Durham IV 2024","6","Round 3","This House Prefers a World where Wealth is Seen as Shameful"
"Durham IV 2024","7","Round 2","In places with high levels of crime against women, This House Supports Vigilante Feminism"
"Durham IV 2024","8","Round 1","This House Would Legalise Graffiti"
"Durham Schools 2023","1","Novice Finals","TH, as Iron Man, would not invent time travel"
"Durham Schools 2023","2","Novice Semifinals","THW teach rap as part of the literature curriculum in schools."
"Durham Schools 2023","3","Grand Final","TH, as an average individual would opt into the artificial afterlife"
"Durham Schools 2023","4","Semifinals","TH, as the USA, would cut ties with Saudi Arabia"
"Durham Schools 2023","5","Quarterfinals","TH opposes the framing of social justice issues as a battle between generations"
"Durham Schools 2023","6","Round 4","THO the rise of Comedy News Programmes (e.g. Last Week Tonight with John Oliver, The Mash Report, Have I Got News for You)"
"Durham Schools 2023","7","Round 3","THW Ban MP’s from resigning during elected tenure"
"Durham Schools 2023","8","Round 2","THW make rehabilitation the sole criteria for releasing criminals from prison"
"Durham Schools 2023","9","Round 1","THR the rise of the gig economy"
"East Malaysia Open 2024","1","Grand Final","In communities where Christianity is declining, TH, as church leaders, W preach Christian Universalism."
"East Malaysia Open 2024","2","Novice Finals","TH supports the stigmatization of public displays of extreme emotion (i.e anxiety, crying, screaming in public, jubilation)."
"East Malaysia Open 2024","3","Semi Finals","TH supports a complete takeover of the Oil and Gas industry in Sarawak by Petros."
"East Malaysia Open 2024","4","Novice Semifinals","THW remove the Federal List in Malaysia."
"East Malaysia Open 2024","5","Quarter Final","In post-colonial societies, THBT local intellectuals who produced knowledge that justifies colonial presence (e.g., scholars whose lectures taught colonization was a path to modernity or artists who encouraged people to partake in colonial expansion) should be tried and punished as war criminals."
"East Malaysia Open 2024","6","Pre-Quarter Final","THW boycott the Qatar Grand Prix"
"East Malaysia Open 2024","7","Round 4","TH prefers a world where the majority of individuals live with their extended family (i.e. including grandparents, relatives, etc.), instead of only with their nuclear family."
"East Malaysia Open 2024","8","Round 3","TH supports the creation of international body for the extraction of rare earth elements."
"East Malaysia Open 2024","9","Round 2","THBT diversity policies (e.g. needs-based scholarships, affirmative action) should target acquired diversity rather than inherent diversity."
"East Malaysia Open 2024","10","Round 1","THW mandate all citizens to undergo a period of working for national service, in sectors including but not limited to military, charity, and civil services (e.g. police, firefighting)."
"Easters 2022","1","Grand Final","That we would accept the deal proposed by the Sackler family"
"Easters 2022","2","Semifinals","That the UN should deploy troops alongside its current WHO presence in the Democratic Republic of Congo to contain Ebola outbreaks"
"Easters 2022","3","Quarterfinals","A: That we, as a prominent religious leader, would actively encourage our followers to pursue acts of supererogation"
"Easters 2022","4","Octofinals","A. That, as Japan, we would host US nuclear missiles"
"Easters 2022","5","Round 6","A: That we support character integrity obligations clauses"
"Easters 2022","6","Round 5","A: That we support the use of human challenge trials"
"Easters 2022","7","Round 4","A: That all green energy policies should be source neutral"
"Easters 2022","8","Round 3","A: That we support the formation of an EU army"
"Easters 2022","9","Round 2","A: That it would be in the interests of the Liberal Party to run Gladys Berejiklian in the seat of Warringah at the 2022 Federal Election"
"Easters 2022","10","Round 1","A: That we should ban the publication of course evaluations"
"Edinburgh Cup 2022","1","Pro Am Finals","THS the Hikikomori policy of the Japanese Government"
"Edinburgh Cup 2022","2","Grand Final","TH, as a parent, would raise their child to follow the principles of the law of attraction"
"Edinburgh Cup 2022","3","Semifinals","TH as an African-American with admission to both a well-established historically black university (HBU) and a high-ranking ivy league university would choose to attend the historically black university."
"Edinburgh Cup 2022","4","Round 5","Assuming it is feasible to measure rehabilitation, THW release prisoners purely based on their level of rehabilitation as opposed to having set prison sentences"
"Edinburgh Cup 2022","5","Round 4","TH, as someone leaving a major organised religion, would seek to join a neopagan syncretic movement rather than abandon religion."
"Edinburgh Cup 2022","6","Round 3","In cities with scarce housing availability, THW reallocate funds intended for building or subsidizing affordable housing to providing the means for those in need to relocate to different cities with lower costs of living."
"Edinburgh Cup 2022","7","Round 2","THS the creation of art which alters the events of culturally significant tragedies to have a happy ending e.g. in &#x27;Once Upon a Time in Hollywood&#x27;, Charles Manson&#x27;s victims are saved from being murdered  even though they were killed in real life."
"Edinburgh Cup 2022","8","Round 1","THBT the feminist movement should advocate for the abolition of marriage"
"Edinburgh Cup 2023","1","Grand Finals","THP The World Of Total Belief to the world we currently live in."
"Edinburgh Cup 2023","2","Pro-Am Finals","THW abolish the &#x27;right to roam&#x27; in Scotland."
"Edinburgh Cup 2023","3","Semifinals","TH Hopes for the increased prevalence of Pan-Africanism."
"Edinburgh Cup 2023","4","Round 5","THP UK foundation training allocations to be random rather than performance-based."
"Edinburgh Cup 2023","5","Round 4","THW produce &quot;Ending A&quot; over &quot;Ending B&quot;."
"Edinburgh Cup 2023","6","Round 3","TH Predicts that Scottish Labour will form the government after the next parliamentary election."
"Edinburgh Cup 2023","7","Round 2","THR the use of international sport as a unifying national narrative."
"Edinburgh Cup 2023","8","Round 1","THO girlification."
"Edinburgh Cup 2024","1","Pro-Am Finals","THS the UK legalising all drugs"
"Edinburgh Cup 2024","2","Grand Final","THW stop consuming the concotion"
"Edinburgh Cup 2024","3","Semifinals","TH prefers a world in which the protestant work ethic is the dominant narrative within religions"
"Edinburgh Cup 2024","4","Round 5","THS the centralisation of the Chinese banking sector"
"Edinburgh Cup 2024","5","Round 4","THO moral relativism"
"Edinburgh Cup 2024","6","Round 3","THS the feminist movement adopting female religious figures in their advocacy (i.e. Virgin Mary, Aisha, Mother Theresa etc)"
"Edinburgh Cup 2024","7","Round 2","THP a world in which people see relationships as transactional"
"Edinburgh Cup 2024","8","Round 1","THW implement a $1 million per year salary cap on all athletes"
"Edinburgh Open 2023","1","Grand Final","TH as Bob would wake Jane up"
"Edinburgh Open 2023","2","Semi Finals","THW mandate large financial institutions on the brink of collapse to be bailed-in by their creditors as opposed to pursuing a state-funded bail-out."
"Edinburgh Open 2023","3","Pro-Am Final","THP a world in which the chip exists"
"Edinburgh Open 2023","4","Round 5","THR the glorification of start-up culture"
"Edinburgh Open 2023","5","Round 4","THW legalise vigilantism in high crime areas"
"Edinburgh Open 2023","6","Round 3","THR the prevalence of &#x27;choice feminism&#x27;"
"Edinburgh Open 2023","7","Round 2","THR the trend of football clubs sacking coaches in off seasons"
"Edinburgh Open 2023","8","Round 1","THBT it&#x27;s better to grow up in a village than in a city"
"Eindhoven Open 2025","1","Pro-Am Finals","THS the rise of morally gray villains in media"
"Eindhoven Open 2025","2","Grand Final","THS the project Rearm Europe."
"Eindhoven Open 2025","3","Semifinals","THR the decline of small local businesses"
"Eindhoven Open 2025","4","Round 5","THS the depoliticization of the feminist movement"
"Eindhoven Open 2025","5","Round 4","THP women enrolling in separate women&#x27;s military factions (e.g. Cumann na mBan in Northern Ireland, the Women&#x27;s Protection Unit in Syria, etc) as opposed to enrolling in a mixed-gender military faction."
"Eindhoven Open 2025","6","Round 3","This House believes that ethnically and culturally diverse countries should adopt a prescriptive, rather than descriptive approach in language policies in their official language."
"Eindhoven Open 2025","7","Round 2","THR the rise of free-to-play models in video games"
"Eindhoven Open 2025","8","Round 1","THBT governments should prioritise universal basic assets over universal basic income"
"Erasmus Novice Cup 2023","1","Final","TH, as the football player, Would dope too"
"Erasmus Novice Cup 2023","2","Round 3","THW allow members of the military to form labor unions"
"Erasmus Novice Cup 2023","3","Round 2","THS the creation of a license to raise children"
"Erasmus Novice Cup 2023","4","Round 1","THO the increased use of online dating apps"
"Erasmus Rotterdam Open 2023","1","Grand Final","Assuming political feasibility, THS the use of the Reality Splitter by governments as a solution for major international conflicts over land (for example, using it to create two states occupying the same geographic area)."
"Erasmus Rotterdam Open 2023","2","ProAm Finals","THO the rise in sequels and remakes of popular franchises in media"
"Erasmus Rotterdam Open 2023","3","Semifinals","THBT developing countries should pursue investment agreements that require state-to-state arbitrations, compared to agreements which grant foreign investors standing to sue governments in investor-state arbitrations."
"Erasmus Rotterdam Open 2023","4","Round 5","THS state attempts to help their citizens find and sustain love (e.g. subsidizing subscriptions to dating apps, significant funding for research on what makes a relationship last, creating courses on how to woo and keep a spouse)"
"Erasmus Rotterdam Open 2023","5","Round 4","THW break up the Big Three"
"Erasmus Rotterdam Open 2023","6","Round 3","THS a global pause on further AI development"
"Erasmus Rotterdam Open 2023","7","Round 2","THW abolish the Joint Enterprise doctrine"
"Erasmus Rotterdam Open 2023","8","Round 1","THO the stigmatisation of esotericism (e.g. tarot reading, astrology, witchcraft)"
"Erasmus Rotterdam Open 2024","1","Grand Final","In times of war, THS anti-war movements actively endorsing the practice of, and individuals practicing, “academically forced delayed enlistment”."
"Erasmus Rotterdam Open 2024","2","Semifinals","THBT China should aggressively pivot to the production of advanced microprocesors."
"Erasmus Rotterdam Open 2024","3","Round 5","THW ban the development of Herafter AI and similar technologies"
"Erasmus Rotterdam Open 2024","4","Round 4","THBT the rising portrayal of female rage in television and film does more harm than good (Amy Dunne in Gone Girl, Maxxine in Pearl, Kiddo in Kill Bill)."
"Erasmus Rotterdam Open 2024","5","Round 3","THBT governments should implement a &quot;no-fault compensation scheme&quot;."
"Erasmus Rotterdam Open 2024","6","Round 2","TH, as the Scottish Greens, would campaign on a platform of joining a coalition with the SNP at the next Scottish election."
"Erasmus Rotterdam Open 2024","7","Round 1","This House regrets the narrative that adults should be independent (i.e. supporting themselves financially, living on their own, being emotionally self-sufficient etc.)"
"Eristic BP 2024","1","Grand Final","THW abolish all property inheritance to redistribute it among the poor"
"Eristic BP 2024","2","Semifinals","THS the creation of a global space station with the mandate to pool all globally available space resources of different countries to carry out space exploration"
"Eristic BP 2024","3","Quarterfinals","THBT all big tech companies should be provided unconditional immunity from civil prosecutions owing to concerns around regulating free speech globally (eg: Russia imposing a 20 decillion fee on Google for removing videos from YouTube made by Kremlin backed channels, Parler [a social media platform popular among conservative users] suing Amazon for deplatforming it post the Jan 6 capital riots in the USA, etc.)"
"Eristic BP 2024","4","Novice Finals","THS the creation of a global space station with the mandate to pool all globally available space resources of different countries to carry out space exploration"
"Eristic BP 2024","5","Novice Semi-Finals","THBT all big tech companies should be provided unconditional immunity from civil prosecutions owing to concerns around regulating free speech globally (eg: Russia imposing a 20 decillion fee on Google for removing videos from YouTube made by Kremlin backed channels, Parler [a social media platform popular among conservative users] suing Amazon for deplatforming it post the Jan 6 capital riots in the USA, etc.)"
"Eristic BP 2024","6","Round 5","THBT Feminist Movement should actively endorse the ethics of care"
"Eristic BP 2024","7","Round 4","In disaster prone states, THBT governments issuing catastrophe (CAT) bonds does more harm than good"
"Eristic BP 2024","8","Round 3","THS the widespread usage of Tech Nagda"
"Eristic BP 2024","9","Round 2","THW disallow private equity firms from investing in healthcare companies"
"Eristic BP 2024","10","Round 1","In countries with significant religious diversity, THW mandate governments to implement multireligious quotas proportional to the population across all levels of their administration"
"EUDC 2021","1","ESL Final","THP humans to aquire memories* of their past lived experiences upon reaching adulthood rather than staying oblivious    
                                                                                                                           
 * memories of past lived experiences include events, interactions and emotions, but not skills"
"EUDC 2021","2","ESL Semifinals","THBT the Myanmar opposition movement should prioritise demands for an immediate, internationally-observed election over demands for Aung San Suu Kyi to be freed"
"EUDC 2021","3","Grand Final","THS a Multi-Speed Europe"
"EUDC 2021","4","Semifinals","THP religious organisations to actively propagate the idea that faith in a higher power cannot be explained with logic, rather than attempt to explain faith rationally"
"EUDC 2021","5","Quarterfinals","THS Green Central Banking"
"EUDC 2021","6","Round 9","In functioning democracies with one dominant political party, THP opposition parties to predominantly campaign on the basis of moral character (e.g. integrity, transparency, corruption) rather than predominantly on specific issues and policies (e.g. unemployment, education, the environment)."
"EUDC 2021","7","Round 8","THBT states should prioritise high employment rates at the expense of significantly slowing down technological advancement  (e.g. taxing automation, setting a minimum quota for human employees, or banning/limiting use of certain technologies)"
"EUDC 2021","8","Round 7","THR Germany&#x27;s decision to go ahead with the Nord Stream 2 deal with Russia"
"EUDC 2021","9","Round 6","THBT social movements should follow social marxism"
"EUDC 2021","10","Round 5","TH, as the Spanish government, would give Catalonia a chartered regime"
"EUDC 2021","11","Round 4","THBT societal narratives about recovery during crisis should be transformative (attempt to radically change society) rather than restorative (attempt to stabilise current crisis)"
"EUDC 2021","12","Round 3","THO the narrative that love (romantic, familial, etc.) is about sacrifice"
"EUDC 2021","13","Round 2","TH, as a University scholarship fund targeted at marginalized identity groups, W prioritize allocating funds based on merit rather than economic necessity."
"EUDC 2021","14","Round 1","THW prioritise means-based[1] rather than target-based[2] regulation 

[1] e.g of means-based regulations: setting standards that attempt to make the workplace more accessible or banning the use of polluting technologies

[2] e.g of target-based regulations: setting hiring quotas for employees from one particular group, or making companies reduce carbon emissions to X under threat of fines"
"EUDC 2022","1","Grand Final","This House Hopes that intelligent extraterrestrial life exists"
"EUDC 2022","2","Semifinals","This House Believes That the significant rise in retail investing brings more harm than good"
"EUDC 2022","3","Quarterfinals","This House Regrets the increased accessibility of the production and consumption of internet pornography"
"EUDC 2022","4","ESL Finals","This House Would take the pill"
"EUDC 2022","5","ESL Semifinals","This House Believes That the EU should ban Pegasus and similar software"
"EUDC 2022","6","Round 9","This House Would break up the ABCDs"
"EUDC 2022","7","Round 8","This House Opposes the trend toward freelance journalism at the expense of traditional employment in a singular media organisation"
"EUDC 2022","8","Round 7","This House Would dissolve the position of High Representative for Bosnia and Herzegovina"
"EUDC 2022","9","Round 6","THBT the globalisation of art has done more harm than good"
"EUDC 2022","10","Round 5","This House Believes That it is in the interests of post-Soviet Central Asian states to pivot away from Russia and develop closer political and economic ties with China"
"EUDC 2022","11","Round 4","This House Believes That small European national football leagues should merge into regional leagues (e.g. a Benelux league, a Yugoslavian league, a Scandinavian league, etc.)"
"EUDC 2022","12","Round 3","This House Believes That large cities should adopt the Vienna Model"
"EUDC 2022","13","Round 2","This House Opposes the Commanding Distance military approach"
"EUDC 2022","14","Round 1","This House Would ban zoos"
"EUDC 2023","1","ESL Finals","This House Predicts that Russia will not have control of most of the occupied and contested Ukrainian territories* by the end of the war 

*such as the occupied territories in Donetsk, Luhansk, Kherson and Zaporizhzhia oblasts, Crimea, and the strategically significant contested territories (gray areas) such as Robotyne, Antonivskyi bridge, and Kreminna forest"
"EUDC 2023","2","ESL Semifinals","This House Hopes that the future of humanity is transhumanism"
"EUDC 2023","3","ESL Quarterfinals","This House Believes That the EU should create a specialized court responsible for investigating and prosecuting political corruption across its member states"
"EUDC 2023","4","Grand Final","Assuming it can be done with no risk to humanity&#x27;s existence, This House Believes That God should be killed"
"EUDC 2023","5","Semifinals","This House Opposes the strategy of deficit financing by Liberal Democracies"
"EUDC 2023","6","Quarterfinals","This House Prefers a world without the desire for revenge"
"EUDC 2023","7","Partial Octofinals","This House Opposes the commercialization of sex*


*widespread use of sex and sexual imagery to sell products, entertainment and business"
"EUDC 2023","8","Round 9","This House Opposes the rapid development of AI"
"EUDC 2023","9","Round 8","This House Believes That aggressive power projection* in South East Asia is in China&#x27;s interest

*e.g. making territorial claims and increased military presence in the South China Sea; diplomatic pressure; financing large infrastructure projects to exert economic pressure"
"EUDC 2023","10","Round 7","This House Prefers drug regulatory bodies (e.g. FDA, EMA, MHRA) to only evaluate whether pharmaceuticals (e.g. treatments, medicines, vaccines) are safe, but not whether they are effective"
"EUDC 2023","11","Round 6","This House Opposes the use of political messaging in Children&#x27;s Entertainemnt"
"EUDC 2023","12","Round 5","This House Would only provide state pensions to those mentally or physically unable to work"
"EUDC 2023","13","Round 4","This House Predicts that the Judicial Reform will lead to Netanyahu&#x27;s Exit from Office"
"EUDC 2023","14","Round 3","This House Would grant substantial authority to eSports Player Unions, including but not limited to, influence over tournament format, in-game balance, and working conditions"
"EUDC 2023","15","Round 2","This House Believes That news publications should be anonymized and signed as a collective editorial"
"EUDC 2023","16","Round 1","Given the opportunity, This House, as a talented young individual living in Bulgaria, would emigrate to pursue a career in Western Europe"
"EUDC 2024","1","ESL Finals","THR the narrative that dying for romantic love is justified"
"EUDC 2024","2","ESL Semifinals","THP EU legislation of AI to legislation imposed by each EU member state"
"EUDC 2024","3","ESL Quarterfinals","THBT the Old Firm should join the English Football league structure, rather than stay in the Scottish Premiership."
"EUDC 2024","4","Grand Final","THO the recent rise in distrust of state institutions"
"EUDC 2024","5","Semifinals","THP a monarchy where the king has the divine right to rule, as opposed to a theocracy ruled by religious institutions."
"EUDC 2024","6","Quarterfinals","THBT the IMF should declare China an intransigent creditor"
"EUDC 2024","7","Partial Octofinals","This House Prefers a Common Law system over a Civil Law system"
"EUDC 2024","8","Round 9","This House prefers Hayekian economic policies to Keynesian economic policies"
"EUDC 2024","9","Round 8","THBT Donald Trump winning the 2024 US Presidential Election is in the interest of the Chinese Communist Party"
"EUDC 2024","10","Round 7","THR the consolidation of the music industry"
"EUDC 2024","11","Round 6","THBT left wing criticism of liberal NGOs for failing to be intersectional brings more harm than good"
