Tournament,Round,Title,Lead
"Luzon IV 2021","5","Novice Semifinals","THBT university council representatives should not take vocal positions on national politics."
"Luzon IV 2021","6","Octofinals","THBT prisoners of war should cooperate with their captors in exchange for bettering their conditions in captivity"
"Luzon IV 2021","7","Round 6","TH, as the Phillipines, would impose a four day work week with a maximum 8 hours per day"
"Luzon IV 2021","8","Round 5","TH, as neurodiversity activists, would highlight the successes of neurodivergent people, rather than their unique struggles"
"Luzon IV 2021","9","Round 4","In post-conflict contexts, THP the creation of art with messages of unity and inspiration, rather than art that seeks to depict previous or current suffering"
"Luzon IV 2021","10","Round 3","THBT the UN Security Council should pass the Russia/China resolution"
"Luzon IV 2021","11","Round 2","THW ban financial service institutions from refusing service to industries perceived as immoral (for example, Mastercard refusing service to OnlyFans)"
"Luzon IV 2021","12","Round 1","THS the active use of religious messaging by progressives to advance their political interests"
"Luzon IV 2022","1","Grand Final","THW start believing in religion"
"Luzon IV 2022","2","Open Semifinals","THO the narrative that people should only enter romantic relationships that they anticipate will be sustainable in the long term"
"Luzon IV 2022","3","Open Quarterfinals","THBT the Philippine Opposition should deploy its own trolls against the Marcos-Duterte administration"
"Luzon IV 2022","4","Novice Final","THBT governments of developing countries should prohibit the sale of arable land to foreign states and corporations"
"Luzon IV 2022","5","Novice Semifinals","THBT the Philippine Opposition should deploy its own trolls against the Marcos-Duterte administration"
"Luzon IV 2022","6","Round 5","THC the decline of the &quot;family comes first&quot; narrative"
"Luzon IV 2022","7","Round 4","THO RSS&#x27; participation in the R20 Forum"
"Luzon IV 2022","8","Round 3","THBT the LGBTQIA+ community should actively reject the &quot;glass closet&quot; lifestyle"
"Luzon IV 2022","9","Round 2","THBT the pursuit of a &quot;green future&quot; has done more harm than good in the fight against climate change"
"Luzon IV 2022","10","Round 1","THR the dominant emphasis placed on achieving self-actualization (over other interests like family, community, etc.)"
"Luzon IV 2023","1","Novice Finals","TH, as the soldier, would flee rather than fight"
"Luzon IV 2023","2","Novice Semifinals","THS the decentralization of the Philippine basic education system"
"Luzon IV 2023","3","Grand Final","THP a world where personality is genetically engineered"
"Luzon IV 2023","4","Semifinals","THBT it is in the interest of Southeast Asian states to actively demilitarize their war on terror"
"Luzon IV 2023","5","Quarterfinals","THS the complete declassification of all documents related to the US&#x27; foreign special operations in the past century"
"Luzon IV 2023","6","Round 5","THR the official recognition of “holy &amp; divine figures” (e.g. canonized saints in Christianity, revered gurus &amp; bodhisattvas in Buddhism, and awliya in Islam) by religious institutions"
"Luzon IV 2023","7","Round 4","THO the NGO-ization of social movements"
"Luzon IV 2023","8","Round 3","THBT states should not provide major esports organizations the state welfare provided to other companies when they are at risk of bankruptcy"
"Luzon IV 2023","9","Round 2","THBT Bhutan should eliminate its tourism tax"
"Luzon IV 2023","10","Round 1","THW break up gated communities in the Philippines"
"Luzon IV 2024","1","High School Final","THBT governments in countries with population decline should aggressively increase immigration"
"Luzon IV 2024","2","Novice Final","THBT post conflict states should use peace polling in resolution building"
"Luzon IV 2024","3","Grand Final","TH, as the Filipino middle class, should evade taxes"
"Luzon IV 2024","4","Semifinals","THBT labor unions should embrace corporate terrorism (e.g. acts of violence, sabotage, and disruption towards the operations of corporations motivated by political, ideological, or economic motivations)"
"Luzon IV 2024","5","Pre-semifinals","TH, as South Korea, would implement restrictive population controls"
"Luzon IV 2024","6","Round 4","TH, as President Bongbong Marcos, would reopen the Bataan Nuclear Power Plant"
"Luzon IV 2024","7","Round 3","THBT South Korea should nuclearize"
"Luzon IV 2024","8","Round 2","THBT San Miguel Corporation&#x27;s further expansion is within the interest of the Filipino people"
"Luzon IV 2024","9","Round 1","THBT educational institutions should abandon merit-based aid and scholarships"
"Macau Debate Open 2025","1","Schools Final","This House Regrets the decline in Open Source development in AI Model"
"Macau Debate Open 2025","2","Novice Final","THP a world in which eulogies before death was normalise"
"Macau Debate Open 2025","3","Novice Semifinals","This House Regrets the decline in Open Source development in AI Model"
"Macau Debate Open 2025","4","Novice Quarterfinals","THBT developing countries should develop carbon emissions trading markets"
"Macau Debate Open 2025","5","Grand Final","THP the life of an average monkey who lives in a resourceful jungle rather than the life of an average human being."
"Macau Debate Open 2025","6","Semifinals","THBT Faithtok does more harm than good"
"Macau Debate Open 2025","7","Quarterfinals","THR the wide use of constructive ambiguity in International Law."
"Macau Debate Open 2025","8","Round 5","TH, as feminism movement, would actively embrace and spread non-traditional relationship model (e.g. female-domination relationships, situationships)"
"Macau Debate Open 2025","9","Round 4","TH, as an average North East Asian, would opt into the belief that all morality is artificially constructed."
"Macau Debate Open 2025","10","Round 3","TH, as the USA, welcomes the Department of Government Efficiency (DOGE)"
"Macau Debate Open 2025","11","Round 2","This House, as the athlete, Would choose to a play in a foreign league"
"Macau Debate Open 2025","12","Round 1","This House Supports a 100% heritage tax."
"Mahasangram 2021","1","Novice Finals","TH, as Nepal, would pursue stronger diplomatic and economic ties with China"
"Mahasangram 2021","2","Grand Final","THR the glorification of the immediate postcolonial leaders in Asia"
"Mahasangram 2021","3","Semifinals","This House would abolish the private ownership of (housing) property in major metropolitan areas."
"Mahasangram 2021","4","Round 5","THBT the queer community should actively embrace religious organisations and queer religious individuals in its leadership positions and advocacy."
"Mahasangram 2021","5","Round 4","For nonviolent infractions (e.g. failure to pay tax or debts, possession of illict substances), THP an individual social credit system over incarceration."
"Mahasangram 2021","6","Round 3","This House Believes That resource-rich developing countries should nationalise all resource extraction companies"
"Mahasangram 2021","7","Round 2","No Lead"
"Mahasangram 2021","8","Round 1","THBT parents and educators should actively encourage children to invest in their appearance and attractiveness"
"Mahasangram 2024","1","Grand Final","This House supports the development of BRICS Pay"
"Mahasangram 2024","2","School Finals","This House opposes the monetization of spiritual market"
"Mahasangram 2024","3","Novice Finals","This House regrets the rise of quiet quitting within corporate environments"
"Mahasangram 2024","4","Semi Finals","This House prefers a world where the anticipation of death is perceived as the only meaningful way to live"
"Mahasangram 2024","5","Quarter Final","This House believes that Western liberal democracies should significantly increase their positive engagement with the Taliban as the self-proclaimed legitimate government of Afghanistan."
"Mahasangram 2024","6","Round 5","As the climate change movement, this House would support geo-engineering"
"Mahasangram 2024","7","Round 4","If and when AI develops to this level of maturity, this House supports the use of AI to regenerate realistic, interactive personas of important historical figures"
"Mahasangram 2024","8","Round 3","This House would require the annual percentage of salary increase in all sectors to be much closely pegged to the increase of national inflation rate"
"Mahasangram 2024","9","Round 2","This House supports deglamorizing the popular narrative surrounding the act of &quot;conquering the Everest&quot;"
"Mahasangram 2024","10","Round 1","This House supports Australia&#x27;s social media ban for those under 16"
"Makiling Pre-ABP 2023","1","Grand Final","TH, as the Pevensie siblings, would stay in Narnia."
"Makiling Pre-ABP 2023","2","Semifinals","THR the trend of Self-centricity"
"Makiling Pre-ABP 2023","3","Novice Final","THR the trend of Self-centricity"
"Makiling Pre-ABP 2023","4","Quarterfinals","THS the &quot;Russian Interference&quot; law"
"Makiling Pre-ABP 2023","5","Round 4","THBT states should regulate firms using traditional anti-monopoly regulations instead of mandating that companies meet a threshold of public good proportionate to their size"
"Makiling Pre-ABP 2023","6","Round 3","THR the trend of the &quot;f2p&quot; business model in gaming"
"Makiling Pre-ABP 2023","7","Round 2","THS vigilanteism in high crime areas"
"Makiling Pre-ABP 2023","8","Round 1","THR the narrative that humans are rational beings"
"Malaysia BP 2022","1","Novice Finals","THR the trend of offering relationship advice on social media (e.g. encouraging individuals to go no-contact with their families if the latter displays certain toxic traits)."
"Malaysia BP 2022","2","Novice Semifinals","No Lead"
"Malaysia BP 2022","3","Grand Final","THBT in fragile democracies, progressive activists should not publicly criticise progressive governments."
"Malaysia BP 2022","4","Semifinals","THW impose carbon limits on households."
"Malaysia BP 2022","5","Quarterfinals","Novice : THBT the addition of romantic storylines to children&#x27;s movies (e.g. Frozen, The Lion King, Mulan) does more harm than good.

Open: THW require retail investors to pass a financial general knowledge test before being allowed to make trades."
"Malaysia BP 2022","6","Round 4","THW abolish the legal institution of marriage."
"Malaysia BP 2022","7","Round 3","THBT the Catalonian independence movement should cease the fight for secession in favour of more seats in parliament."
"Malaysia BP 2022","8","Round 2","Assuming that the Earth encountered extraterrestrial life, TH as the human race, would avoid all contact with them and keep our existence a secret insofar as they possess or have discovered space travel for themselves."
"Malaysia BP 2022","9","Round 1","THR the emphasis on character and ethical flaws in symbols of humanitarian movements (eg Mother Teresa, Gandhi, MLK Jr.)"
"Malaysia BP 2023","1","Novice Finals","THR the overuse of zero to hero trope in medias"
"Malaysia BP 2023","2","Grand Final","No Lead"
"Malaysia BP 2023","3","Semifinals","TH, as China, would actively support the resistance movement in Myanmar"
"Malaysia BP 2023","4","Round 4","No Lead"
"Malaysia BP 2023","5","Round 3","TH celebrates the fall of X (formerly known as Twitter)​"
"Malaysia BP 2023","6","Round 2","THW MANDATE PROVEN PROFITABILITY AS A PREREQUISITE FOR COMPANIES TO ISSUE AN IPO​"
"Malaysia BP 2023","7","Round 1","​THW abolish all requirements for divorce (such as the fault-based requirement for divorce, minimum separation/waiting periods, counselling, etc.)​"
"Malaysia BP 2024","1","Novice Finals","THR the emphasis on hard work as the key to success"
"Malaysia BP 2024","2","Grand Final","THP a world where the &quot;Reductio Emotionum&quot; device is widely available."
"Malaysia BP 2024","3","Semifinals","THBT states in ongoing civil conflicts should offer amnesty to defectors of insurgent groups in exchange for them agreeing to serve in the military"
"Malaysia BP 2024","4","Round 4","This house believes that feminists in Muslim-majority countries should advocate for the abolishment of Sharia Courts rather than working to reform it (e.g. advocating for more female judges, pushing for feminist interpretations of the Quran)"
"Malaysia BP 2024","5","Round 3","THBT local city governments in major metropolitan cities should prioritise infilling existing neighbourhoods as opposed to creating new neighbourhoods"
"Malaysia BP 2024","6","Round 2","THR the glorification of the &quot;starving artist&quot;"
"Malaysia BP 2024","7","Round 1","THBT that language education in schools should be descriptive rather than prescriptive."
"Malaysia IV 2020","1","Novice Finals","No Lead"
"Malaysia IV 2020","2","Novice Semifinals","No Lead"
"Malaysia IV 2020","3","Grand Final","No Lead"
"Malaysia IV 2020","4","Semifinals","No Lead"
"Malaysia IV 2020","5","Quarterfinals","No Lead"
"Malaysia IV 2020","6","Round 4","No Lead"
"Malaysia IV 2020","7","Round 3","No Lead"
"Malaysia IV 2020","8","Round 2","No Lead"
"Malaysia IV 2020","9","Round 1","No Lead"
"Malyasia Online Debate Open 2025","1","Novice Finals","THBT, when allocating resources to their children, working class families should allocate most of their resources to support the most talented child in the family"
"Malyasia Online Debate Open 2025","2","Novice Semifinals","THP a world in which wealthy individuals with guaranteed financial security do not seek employment"
"Malyasia Online Debate Open 2025","3","Grand Final","THBT religious institutions should embrace the widespread use of &#x27;Deus in Machina&#x27;"
"Malyasia Online Debate Open 2025","4","Semifinals","THBT it is in the interest of China for EU to distance itself from US foreign policy"
"Malyasia Online Debate Open 2025","5","Quarterfinals","THR the dominant narrative emphasising individual self-actualisation"
"Malyasia Online Debate Open 2025","6","Pre Quarter Finals","THP the use of the &quot;Pay-for-Success&quot; model to a direct funding model when funding social services"
"Malyasia Online Debate Open 2025","7","Round 4","THO the shift toward freelance journalism at the expense of traditional employment in a singular media organisation"
"Malyasia Online Debate Open 2025","8","Round 3","THBT feminist movements should actively support depictions of reverse sexism in the media"
"Malyasia Online Debate Open 2025","9","Round 2","THP the &quot;&quot;day-in-day-out&quot;&quot; model of the work study degree as opposed to the &quot;&quot;year-in-year-out&quot;&quot; model"
"Malyasia Online Debate Open 2025","10","Round 1","THS Jonathan Haidt&#x27;s policy proposals"
"Manchester IV 2023","1","Pro-Am Finals","A zombie infection has broken out. THBT it is morally legitimate to kill uninfected humans to increase your own chances of survival."
"Manchester IV 2023","2","Grand Final","THBT it is in the US interest to destroy pipelines that transport Russian gas to foreign countries"
"Manchester IV 2023","3","Semifinals","THBT India should remove its ban on &quot;The Satanic Verses&quot;"
"Manchester IV 2023","4","Round 5","THW teach children to be skeptical of the mainsteam media"
"Manchester IV 2023","5","Round 4","THP a world where people are incapable of feeling envy"
"Manchester IV 2023","6","Round 3","THS shadow banking in developing countries"
"Manchester IV 2023","7","Round 2","THBT the rise of Progressive Prosecutors does more harm than good"
"Manchester IV 2023","8","Round 1","THP lyrics in breakup music where songwriters focus on the process of self empowerment (e.g. &quot;I can buy myself flowers&quot;) to lyrics which shame their exes (e.g. &quot;Ah, so much time at the gym, but maybe work out your brain a bit too&quot;)."
"Manchester IV 2024","1","Grand Final","THP a world where everyone has Chronic Pinocchiosis"
"Manchester IV 2024","2","Semifinals","TH, as Javier Milei, would withdraw Argentina from Mercosur"
"Manchester IV 2024","3","Round 5","THP centralised urban planning system to decentralised urban planning system"
"Manchester IV 2024","4","Round 4","THS the revival of TCM in China"
"Manchester IV 2024","5","Round 3","THS the widespread adoption of CBDCs"
"Manchester IV 2024","6","Round 2","THO pop psychology"
"Manchester IV 2024","7","Round 1","THBT social movements should not criticise people for virtue-signalling"
"Manchester IV 2025","1","Novice Finals","Assuming the technology exists, This House Would allow the buying and selling of intelligence."
"Manchester IV 2025","2","Grand Final","This House Believes That Diversity, Equity, and Inclusion policies have done more harm than good."
"Manchester IV 2025","3","Semifinals","This House Believes That the aggressive deregulation of the European common market is in the interests of the EU."
"Manchester IV 2025","4","Round 5","This House Regrets the rise of online dating platforms."
"Manchester IV 2025","5","Round 4","This House Would ban exclusive private arbitration for contracts between corporations and individuals"
"Manchester IV 2025","6","Round 3","This House Opposes the glorification of resilience."
"Manchester IV 2025","7","Round 2","This House Would require Premier League players to randomly rotate between teams every two years."
"Manchester IV 2025","8","Round 1","This House Opposes the scepticism toward political compromise within progressive spaces."
"Manchester Novices 2023","1","Non-schools Finals","THBT it is in the interest of the Catholic church to allow the ordaining of female priests"
"Manchester Novices 2023","2","Silver Finals","TH, as a young adult exploring a new connection, would use the machine"
"Manchester Novices 2023","3","Grand Final","THW prevent spiritual practitioners for example psychics, exorcists and fortune tellers charging for their services"
"Manchester Novices 2023","4","Round 4","THP a world where all fictional work is published anonymously"
"Manchester Novices 2023","5","Round 3","THBT it is in the interest of environmental movements to prioritise policy that aims to lower the broad damage of climate change e.g lower levels of greenhouse gases and cleaner oceans at the cost of localised effects e.g extinction of endangered species and the destruction of local communities"
"Manchester Novices 2023","6","Round 2","THR the trend of social movements targeting their campaigns towards the youth"
"Manchester Novices 2023","7","Round 1","THW ban the publication of electoral polls during the run-up to an election"
"Manchester Schools 2023","1","Novice Finals","This House believes that Shelley should go to her dream University right away"
"Manchester Schools 2023","2","Grand Final","THW implement the &#x27;Blue Shell Award&#x27;"
"Manchester Schools 2023","3","Round 4","THW implement a 4 day working week"
"Manchester Schools 2023","4","Round 3","Assuming feasiblity THS the use of technology that exactly imitates deceased loved ones in appearance, personality and manner."
"Manchester Schools 2023","5","Round 2","THW significantly reduce income tax rates for women"
"Manchester Schools 2023","6","Round 1","THR dominant narratives of good triumphing over evil in children&#x27;s fiction"
"Manzar 2024","1","Grand Final","THS the rise of private cities in the developing world"
"Manzar 2024","2","Novice Finals","THS a world where the Empathy Gun exists and is widely accessible"
"Manzar 2024","3","Semifinals","THR Burkina Faso’s decision to terminate its military accord with France."
"Manzar 2024","4","Novice Semifinals","THBT India should move to a 4 day workweek."
"Manzar 2024","5","Open Pre-semifinal","THBT India should move to a 4 day workweek."
"Manzar 2024","6","Round 5","THBT it is better to have had a good thing and lost it than to never to have had it at all"
"Manzar 2024","7","Round 4","THS aggressive funding towards carbon sequestration efforts."
"Manzar 2024","8","Round 3","THBT the development organizations should closely work with religious institutions in developing countries."
"Manzar 2024","9","Round 2","Assuming feasibility, THBT schools should abolish primary and secondary school grades that group children based on age, and instead group them by competency and intelligence"
"Manzar 2024","10","Round 1","THS the implementation of film quotas"
"Manzar Open 2022","1","Grand Final","TH, as the feminist movement in a liberal democracy, would heavily prioritize supporting feminist activism in fledgling democracies."
"Manzar Open 2022","2","Semifinals","As a young working professional in a stable but 9-5 job, THW choose not to use the technology."
"Manzar Open 2022","3","Pre Semi Finals","THBT developing countries should adopt MGNREGA-style rural employment guarantees"
"Manzar Open 2022","4","Round 5","THR the rise of social media as a primary source of news distribution"
"Manzar Open 2022","5","Round 4","THBT non-western countries who were once colonized, when fabricating the material culture of national identity (anthems, street names, holidays, flag, etc.) should privilege pre colonial history and notions of indigeneity over themes of anti colonial resistance."
"Manzar Open 2022","6","Round 3","THP a world where non romantic co-parenting is the dominant norm."
"Manzar Open 2022","7","Round 2","THR the rise of corporate student living spaces like Stanza Living, Your Space, etc."
"Manzar Open 2022","8","Round 1","TH, as the feminist movement would vocally support Kim Kardashian through her divorce proceedings."
"Manzar Open 2023","1","Grand Final","THBT India should not resume Lok Sabha redistricting to reflect states’ current populations in 2031."
"Manzar Open 2023","2","Novice Finals","THR the development of nuclear weapons."
"Manzar Open 2023","3","Semifinals","TH, as China, would prioritize future investments in agriculture (e.g., irrigation, R&amp;D, mechanization and other inputs like fertilizer) over investments in infrastructure and manufacturing across sub-Saharan Africa."
"Manzar Open 2023","4","Novice Semifinals","THW ban religious charities from proselytizing in developing countries."
"Manzar Open 2023","5","Quarterfinals","THBT liberal democracies should finance the creation and operation of “recovery from religion” organizations."
"Manzar Open 2023","6","Pre-Quarter Finals","During corporate restructuring that involves layoffs, THW require that companies prioritize laying off workers who have the best chance of finding new jobs (e.g., people who are younger, more geographically mobile, or have more cross-applicable skills)."
"Manzar Open 2023","7","Round 5","THP a world where an artificial general intelligence is not developed."
"Manzar Open 2023","8","Round 4","THBT the United States should legalize the sale and consumption of cocaine."
"Manzar Open 2023","9","Round 3","THBT major farmed animal advocacy organizations and funders in Western liberal democracies should prioritize expansion to developing countries over domestic animal welfare concerns."
"Manzar Open 2023","10","Round 2","THR the portrayal of women from history in positions of political power as symbols of women’s strength and liberation in popular media (e.g., the film Manikarnika’s portrayal of Rani Laxmibai in India as an icon for women, the TV show The Great about Russian emperor Catherine II, or The Empress of China’s portrayal of Wu Zetian, China’s only female emperor)."
"Manzar Open 2023","11","Round 1","THS substantial parental oversight and involvement in the development of school curricula that applies to their children (e.g., allowing parents to vet books, involving them in curriculum-drafting processes)."
"McGill IV 2024","1","Novice Finals","This House believes that all legal proceedings (both civil and criminal) directly involving Donald Trump should be televised."
"McGill IV 2024","2","Grand Final","This House believes that a US-recognized independent Palestinian state will exist within 15 years."
"McGill IV 2024","3","Semifinals","This House prefers atomic communitarianism to contemporary liberal democracy."
"McGill IV 2024","4","Quarterfinals","Assuming feasibility, This House prefers a world with the TrustHuman system."
"McGill IV 2024","5","Round 5","This House believes that peak globalization has already been reached."
"McGill IV 2024","6","Round 4","This House opposes the expectation of prominent Muslims in Western Liberal Democracies (WLDs) to condemn problems in Muslim countries e.g. terrorism, women&#x27;s rights, LGBT discrimination."
"McGill IV 2024","7","Round 3","This House regrets the addition of Prolonged Grief Disorder to the DSM."
"McGill IV 2024","8","Round 2","This House believes that governments should introduce the “Zombie Voting System” for firms that receive significant assistance during financial crises."
"McGill IV 2024","9","Round 1","This House opposes the stigmatisation of esotericism (e.g. tarot reading, astrology, witchcraft)."
"McGill IV 2025","1","Novice Finals","This House regrets the trivialization of young love"
"McGill IV 2025","2","Grand Final","This House believes that it would be unethical for you to press the button"
"McGill IV 2025","3","Semifinals","[Redacted]"
"McGill IV 2025","4","Quarterfinals","This House prefers the fundholder-owned model to the shareholder-owned model in investment management firms"
"McGill IV 2025","5","Round 5","This House believes that the United States should legalize cocaine"
"McGill IV 2025","6","Round 4","This House regrets the shift in consumption from offline, single-player video games (e.g., God of War, Grand Theft Auto V, The Elder Scrolls V: Skyrim) to online, multiplayer video games (e.g., Rust, Fortnite, Grand Theft Auto Online)"
"McGill IV 2025","7","Round 3","This House, as Alberta, prefers a world where Quebec successfully seceded from Canada in 1995"
"McGill IV 2025","8","Round 2","This House would require medical centers to document and publish the findings from their morbidity and mortality conferences"
