Tournament,Round,Title,Lead
"Sofia Online 2024","9","Round 3","This house opposes the phenomenon where founders of companies remain in significant leadership positions (CEO, President, Techno-King...) in the company for a long time after it has gone public"
"Sofia Online 2024","10","Round 2","THBT that major cities should adopt the Amsterdam rental model."
"Sofia Online 2024","11","Round 1","This house regrets the norm of traditionally feminine professions being considered high empathy careers (e.g. nursing, teaching)"
"Sofia Online Pt2 2024","1","Novice Finals","This house, as a member of a financially stable family, would rather be an only child than a middle sibling of three"
"Sofia Online Pt2 2024","2","ESL Finals","Knowing her punishment, This house, as Eve, would still eat from the tree of knowledge"
"Sofia Online Pt2 2024","3","ESL Semifinals","This house supports cross carpeting in African politics"
"Sofia Online Pt2 2024","4","ESL Quarterfinals","This house opposes the golden rule"
"Sofia Online Pt2 2024","5","Grand Final","TH predicts the coming liberalisation of Iran"
"Sofia Online Pt2 2024","6","Semifinals","This house prefers a world in which sex is seen as special rather than a world in which it is seen as ordinary"
"Sofia Online Pt2 2024","7","Quarterfinals","This house would impose narrow banking regulations"
"Sofia Online Pt2 2024","8","Partial Double Quarterfinals","This house opposes the safetyism approach by universities"
"Sofia Online Pt2 2024","9","Round 5","This house prefers democracies with many different political parties (e.g. the Netherlands, Italy, Israel) as opposed to democracies with one persistently dominant political party (South Africa under the ANC, Japan under the LDP, Croatia under the HDZ)"
"Sofia Online Pt2 2024","10","Round 4","This house supports law firms moving from a traditional partnership model to a private equity model"
"Sofia Online Pt2 2024","11","Round 3","This house, as Shinji, would reject Instrumentality"
"Sofia Online Pt2 2024","12","Round 2","Assuming feasibility, This house would nationalise all high-cost research equipment and create a national pool of this equipment where all researchers must apply to a centralised agency for access"
"Sofia Online Pt2 2024","13","Round 1","This house, as the EU, would abandon the European Green Deal"
"Sofia Open 2022","1","Novice Finals","Assuming feasibility, THW allow individuals to trade their physical attributes (e.g. nose, hair)"
"Sofia Open 2022","2","Grand Final","THS attacks on non-combatants involved in war activities as a strategy in war"
"Sofia Open 2022","3","Semifinals","In times of economic crisis, THBT governments should withhold information that is likely to damage market confidence"
"Sofia Open 2022","4","Round 5","THW make police commanders personally criminally liable for instances of police brutality committed by their subordinates"
"Sofia Open 2022","5","Round 4","THBT it is in the interest of Bulgaria to have followed the Bled Agreement and become a republic of Yugoslavia"
"Sofia Open 2022","6","Round 3","Where artists die before finishing their works (e.g. as is speculated will happen with George R. R. Martin and Game of Thrones), THS others continuing this work, even where it is contrary to the artist&#x27;s wishes"
"Sofia Open 2022","7","Round 2","THS the majority bonus system"
"Sofia Open 2022","8","Round 1","TH, as a rising and talented young player about to enter a professional league, W prefer a middle-tier team over a top-tier team"
"Sofia Open 2024","1","Novice Finals","THS state attempts to help their citizens find partners and sustain relationships (e.g providing housing support subject to being in long-term relationships, giving significant state financial aid to long term couples)"
"Sofia Open 2024","2","Grand Final","THS making the Belief Machine widely available for use by the public"
"Sofia Open 2024","3","Semifinals","THR the rapid global elimination of barriers to free trade (e.g. the creation of regional free trade agreements like NAFTA, the lowering of import tariffs, increasing the ease of capital flows across borders)"
"Sofia Open 2024","4","Round 5","THBT liberal states should provide legal and financial aid to citizens who wish to permanently emigrate from them, but are otherwise unable to"
"Sofia Open 2024","5","Round 4","THBT the life in the cartel is a better life for Tony Montana than a life of following the law."
"Sofia Open 2024","6","Round 3","THR the dominance of networking culture in the workplace"
"Sofia Open 2024","7","Round 2","THBT the world will become less, rather than more, democratic in the near future."
"Sofia Open 2024","8","Round 1","THR the rise of educational ratings websites such as &#x27;Rate My Professor&#x27;"
"Sofia Pre-EUDC 2023","1","ESL Finals","THW prohibit the publication of autobiographical art by people convicted for serious crimes."
"Sofia Pre-EUDC 2023","2","Open Finals","THO the glorification of self sacrifice in historic military narratives."
"Sofia Pre-EUDC 2023","3","Open Semifinals","THW prohibit the publication of autobiographical art by people convicted for serious crimes."
"Sofia Pre-EUDC 2023","4","Open Quarterfinals","THBT reality TV brings more harm than good."
"Sofia Pre-EUDC 2023","5","Round 5","In post conflict countries, THS the practice of Pacto del Olvido."
"Sofia Pre-EUDC 2023","6","Round 4","THS the West utilizing its economic power to spread democratic and liberal values."
"Sofia Pre-EUDC 2023","7","Round 3","THBT the African Union should introduce a common currency."
"Sofia Pre-EUDC 2023","8","Round 2","THW allow citizens in representative democracies to vote on individual bills in place of their representative, with the representative retaining the voting power of those of their constituents who did not directly vote on that specific bill."
"Sofia Pre-EUDC 2023","9","Round 1","THBT public art installations should be temporary and regularly rotated worldwide"
"Southampton Open 2022","1","Pro-Am Final","THW legalise consensual cannibalism"
"Southampton Open 2022","2","Open Final","THS the concept of an art canon"
"Southampton Open 2022","3","Round 4 (Closed)","THP localised attempts at post conflict justice (e.g. prosecutions, truth and reconciliation commissions, etc.) over international attempts"
"Southampton Open 2022","4","Round 3","THR the prevalence of &#x27;choice feminism&#x27;"
"Southampton Open 2022","5","Round 2","THO the shift in non-STEM academia and higher education teaching to focus on quantitative research as opposed to qualitative research"
"Southampton Open 2022","6","Round 1","TH, as the state of Florida, would attempt to kill all the meth gators"
"Southampton Open 2024","1","Pro-Am Finals Finals","THW teach the twins to read"
"Southampton Open 2024","2","Silver Finals Finals","THP to be born in Factionland as opposed to a Western Liberal Democracy"
"Southampton Open 2024","3","Grand Final","THW legalize secession from the Indian Union of States"
"Southampton Open 2024","4","Round 4","THS Nayib Bukele&#x27;s aggressive crackdown on gangs in El Salvador"
"Southampton Open 2024","5","Round 3","TH Hopes for the SNP to lose the next Scottish Parliament Election"
"Southampton Open 2024","6","Round 2","THW dollarize Argentina&#x27;s economy"
"Southampton Open 2024","7","Round 1","THP a world with a universal norm of filial piety"
"Southampton Open 2025","1","Pro-AM Final","TH, as the woman, would choose to stay."
"Southampton Open 2025","2","Silver Final","THW abandon all efforts to conserve pandas"
"Southampton Open 2025","3","Gold Final","THW implement a global 100% tax on any personal income above 10 million $"
"Southampton Open 2025","4","Round 4","THS the UK government&#x27;s decision to redistribute oversea aid"
"Southampton Open 2025","5","Round 3","THR the rise of the narrative that you should &#x27;experience life&#x27; before having children"
"Southampton Open 2025","6","Round 2","TH, as the player, would join a professional league"
"Southampton Open 2025","7","Round 1","TH prefers a world where gene selection technologies are widely available"
"Southampton Pro-Am 2024","1","Grand Final","TH, as Alice Davis would help Samantha cover up Derek’s murder"
"Southampton Pro-Am 2024","2","Silver Finals","THBT Ireland should abolish the special criminal court"
"Southampton Pro-Am 2024","3","Bronze Finals","This house, as a monotheistic god, would prefer to be a watchmaker god than an interventionalist god."
"Southampton Pro-Am 2024","4","Round 4","THBT the “The Woman Who Has It All” trope in fictional screen media does more harm than good."
"Southampton Pro-Am 2024","5","Round 3","In Western liberal democracies, THP the watchman policing style to the legalistic policing style"
"Southampton Pro-Am 2024","6","Round 2","THR the decrease in difficulty levels in AAA games"
"Southampton Pro-Am 2024","7","Round 1","This House Supports the assassination of authoritarian dictators."
"Southampton Sillies 2025","1","Grand Final","This house, as the staggy virus, prefers to initially infect the world’s leaders instead of ordinary people"
"Southampton Sillies 2025","2","Round 4","This house regrets, with the audience of a rowdy football fan, the rise of football clubs sacking their managers soon after they start getting into a significantly poor form"
"Southampton Sillies 2025","3","Round 3","This house, as a parent, would engage in brainrot"
"Southampton Sillies 2025","4","Round 2","This house believes that liberal democracies should reopen their embassies in Kabul"
"Southampton Sillies 2025","5","Round 1","This house prefers a world in which all livestock are senti-livestock"
"Spring Challenge Open 2025","1","Pro Am Finals","TH, as the animals, would enact a violent revenge against all meat eaters"
"Spring Challenge Open 2025","2","Grand Final","THR Deepseek&#x27;s development and release"
"Spring Challenge Open 2025","3","Semifinals","THBT the deal is in the interests of the new Syrian government"
"Spring Challenge Open 2025","4","Round 5","THS Germany&#x27;s fiscal stimulus package"
"Spring Challenge Open 2025","5","Round 4","TH, as Jewish Orthodox leaders in the U.S., Would encourage American Jews to migrate to Israel"
"Spring Challenge Open 2025","6","Round 3","THW ban accounting firms from offering non-auditing services"
"Spring Challenge Open 2025","7","Round 2","THS publicised litigation"
"Spring Challenge Open 2025","8","Round 1","THP a world where the norm for high school students is to avoid relationships until graduation"
"SSE Riga IV 2023","1","Round 1","THW require all teachers to have a local teaching license"
"SSE Riga IV 2023","2","Round 2","This House regrets the rise of climate finance as an environmental conservation measure"
"SSE Riga IV 2023","3","Round 3","THBT the US should offer significant funding to the Guyanese government to guard against a potential Venezuelan annexation of the Essequibo region"
"SSE Riga IV 2023","4","Round 4","THR the trend of upcoming artists collaborating with controversial figures in the music industry, such as artists, music executives, producers (e.g. Chris Brown, Marilyn Manson, Scooter Braun, posthumous Michael Jackson)"
"SSE Riga IV 2023","5","Round 5","THBT the governments of countries with emerging economies (e.g. Indonesia, Nigeria, Poland) should use political and economic measures to develop regional hubs over a dominant capital city"
"SSE Riga IV 2023","6","Semifinals","In September 1991, THBT the government of the independent Latvia should have published this information"
"SSE Riga IV 2023","7","Grand Final","THBT a meaningful life is one lived in resistance to death"
"St Andrew’s Pre-EUDC 2024","1","Pro-Am Finals","This house opposes snap elections"
"St Andrew’s Pre-EUDC 2024","2","ESL Finals","This house believes that it is in the interest of the European Union to accept North Macedonia and Albania as members"
"St Andrew’s Pre-EUDC 2024","3","Grand Final","This house supports the use of the Emotion Regulator."
"St Andrew’s Pre-EUDC 2024","4","Semifinals","This house believes that sinicisation is in the interests of minority groups in China"
"St Andrew’s Pre-EUDC 2024","5","Quarterfinals","This house regrets private equity firms going public"
"St Andrew’s Pre-EUDC 2024","6","Round 5","This house believes that post-colonial states should heavily prioritise ensuring negative rights over positive rights"
"St Andrew’s Pre-EUDC 2024","7","Round 4","This house believes that companies should implement the dot system"
"St Andrew’s Pre-EUDC 2024","8","Round 3","This house believes that Joe Biden should withdraw from the 2024 US presidential election"
"St Andrew’s Pre-EUDC 2024","9","Round 2","This house regrets the narrative that friendship requires strong obligations (e.g. time-intensive favors, extensive emotional support, strong loyalty)"
"St Andrew’s Pre-EUDC 2024","10","Round 1","This house believes that it is in the interest of working women in the western world to assume there is widespread discrimination in the workplace"
"St Andrews Open 2025","1","Grand Final","This house prefers a world where severance is universally implemented"
"St Andrews Open 2025","2","Semifinals","THBT Latin American countries should prioritise import substitution industrialisation over export oriented industrialisation."
"St Andrews Open 2025","3","Round 5","This house prefers a world where religious beliefs and teachings are not codified into scripture or doctrine"
"St Andrews Open 2025","4","Round 4","THBT it is in the interests of the Conservative Party to actively rehabilitate the image of the Cameron Years

(e.g. by ceasing attacks on their record in 2010-16; promoting their achievements in Government; promoting Cameron-aligned MPs to Cabinet)"
"St Andrews Open 2025","5","Round 3","THBT ECB should adopt the dual mandate"
"St Andrews Open 2025","6","Round 2","THBT progressives should portray bigots purely as victims of social and political narratives, rather than as individuals entirely cognisant of the formations of their ideologies"
"St Andrews Open 2025","7","Round 1","THS prenups"
"Strait Debate Open 2023","1","Novice Final","THW allow parents to give the Politeness Pill to their children under the age of 18, regardless of the children&#x27;s consent."
"Strait Debate Open 2023","2","Grand Final","Assuming feasibility, THW allow the selling of happiness"
"Strait Debate Open 2023","3","Semifinals","THR the Citizen Judges Act in Taiwan."
"Strait Debate Open 2023","4","Pre-Semi Finals","Assuming feasibility, THW adopt a uniform global carbon pricing scheme."
"Strait Debate Open 2023","5","Round 5","THR the glorification of personal achievements"
"Strait Debate Open 2023","6","Round 4","THBT feminist movement should actively oppose Lisa performing in crazy horse shows."
"Strait Debate Open 2023","7","Round 3","THS the rise of microfinance in developing countries"
"Strait Debate Open 2023","8","Round 2","THP to be born in Zomia over to be born in Southeast Asian states."
"Strait Debate Open 2023","9","Round 1","THR the increasing trend of marketization of education"
"Structural Reasons Pre-WUDC 2022","1","ESL Finals","TH, as a young talented worker, W choose to enter the workforce in a job that promises high stability and guaranteed, but slow, career and pay progression, over a more volatile job in which career and pay progression is entirely performance based"
"Structural Reasons Pre-WUDC 2022","2","ESL Semifinals","THS the coalition&#x27;s price cap on Russian oil prices"
"Structural Reasons Pre-WUDC 2022","3","Grand Final","THBT it is immoral for resistance movements to engage in military tactics that are highly likely to result in retaliation against the civilian population"
"Structural Reasons Pre-WUDC 2022","4","Semifinals","THS the promotion of mortal salience in media"
"Structural Reasons Pre-WUDC 2022","5","Quarterfinals","THO increased financialization"
"Structural Reasons Pre-WUDC 2022","6","Round 5","THBT governments should abandon the strategy of &quot;decapitation&quot; in fighting terrorism."
"Structural Reasons Pre-WUDC 2022","7","Round 4","Assuming at least a basic level of services are provided to citizens, THP to be born into a stable dictatorship where democratic expression is curtailed over a volatile democracy"
"Structural Reasons Pre-WUDC 2022","8","Round 3","THBT all startups that become unicorns should be publicly traded"
"Structural Reasons Pre-WUDC 2022","9","Round 2","THP a world with a widespread belief in Radical Freedom"
"Structural Reasons Pre-WUDC 2022","10","Round 1","THBT it is in the interest of the GOP to elect Donald Trump as the Republican candidate for the 2024 US Presidential Election"
"Sudan & DRC Fundraiser 2025","1","Grand Final","THBT it is in the DRC&#x27;s interest to contract the Wagner group in order to combat M23"
"Sudan & DRC Fundraiser 2025","2","Round 3","THW ban Private Equity firms from taking on Private Credit"
"Sudan & DRC Fundraiser 2025","3","Round 2","THO policies aimed at retaining Nollywood&#x27;s dominance"
"Sudan & DRC Fundraiser 2025","4","Round 1","THR the prominence of the talk-about-it approach in mental health advocacy &amp; services"
"Sudan Fundraiser 2024","1","Grand Final","No Lead"
"Sudan Fundraiser 2024","2","Round 3","In European countries where a Cordon Sanitaire (CS) is applied against far-right parties (e.g. France, Sweeden), THBT it is in the interests of mainstream parties should apply the Cordon Sanitaire against far-left parties as well (France Insoumise, Swedish Left Party)."
"Sudan Fundraiser 2024","3","Round 2","THS an abandonment of standardized testing (SAT, ACT) in U.S. colleges"
"Sudan Fundraiser 2024","4","Round 1","THS African countries withdrawing from international judicial institutions (e.g. ICJ, ICC) in favor of regional counterparts (e.g. 
African Court on Human and Peoples&#x27; Rights)"
"Sunway Debate Open 2022","1","Novice Finals","TH, as Doctor Maito, would not tell anyone about the scar"
"Sunway Debate Open 2022","2","Novice Semifinals","This House regrets the idolisation of people considered to be &quot;geniuses&quot;"
"Sunway Debate Open 2022","3","Grand Finals","TH, as the Communist Party of China, hopes that Russia loses the Russia-Ukraine war"
"Sunway Debate Open 2022","4","Semi Finals","THBT developing countries should never commit to having their sovereign debt disputes settled by courts in foreign countries"
"Sunway Debate Open 2022","5","Quarter Finals","TH, as an artist living in a post-conflict state, would create art exclusively with messages of unity and inspiration, rather than exclusively create art depicting previous or ongoing suffering"
"Sunway Debate Open 2022","6","Round 5","In cities with scarce housing availability, THP programmes which provide the means for those in need to relocate to different cities with lower costs of living instead of programmes to build or subsidise affordable housing in the same city"
"Sunway Debate Open 2022","7","Round 4","THS the increasing decentralisation of healthcare"
"Sunway Debate Open 2022","8","Round 3","THP a world where the dominant religion believes in one benevolent god who is the Universe’s sole creator and surveyor (eg. Islam, Christianity), as opposed to a world where the dominant religion believes in many morally ambiguous spiritual entities (eg. Ancient Greek religion, European folklore, animistic beliefs)"
"Sunway Debate Open 2022","9","Round 2","TH, as a progressive young Malaysian politician, would join MUDA rather than PH"
"Sunway Debate Open 2022","10","Round 1","THW mandate that buy outs of major social media platforms be subject to a vote of approval by their users"
"Sunway Debate Open 2023","1","Novice Finals","This House opposes the dominant narrative that you should find a purpose in life"
"Sunway Debate Open 2023","2","Novice Semifinals","This House, as a philanthropic organisation whose sole aim is to do as much good as possible, would heavily prioritise funding long-termist projects"
"Sunway Debate Open 2023","3","Grand Final","This House prefers a world in which a Plumbob indicating the mental and physical health of each person exists"
"Sunway Debate Open 2023","4","Semifinals","This House supports the expansion of BRICS membership"
"Sunway Debate Open 2023","5","Quarterfinals","This House regrets the decision of the 8 members of Las 15, to make themselves available for the FIFA Women&#x27;s World Cup selections"
"Sunway Debate Open 2023","6","Pre-Quarterfinals","As a reputable children&#x27;s book author, this House would choose to queer code main characters in the story"
"Sunway Debate Open 2023","7","Round 5","This House believes that opposition parties in Asian developing countries should adopt the approach of portraying the voter base of the ruling administration as rational and reasonable instead of depicting them as being manipulated by the system through undemocratic means (e.g. revisionism, disinformation)"
"Sunway Debate Open 2023","8","Round 4","This House prefers a world where liberal states do not attempt regime change (e.g. through sanctions, interventions, boycotts) with illiberal states and instead prioritise extending diplomatic relations and peace agreements"
"Sunway Debate Open 2023","9","Round 3","This House would implement substantial measures to impose long-termism in corporate investment culture (e.g. minimum holding periods for shares, yearly rather than quarterly financial reporting, long-term executive compensation plans)"
"Sunway Debate Open 2023","10","Round 2","This House would use faith based rehabilitation in prison"
"Sunway Debate Open 2023","11","Round 1","This House would abolish primary and secondary school years that group children based on age, and instead group them by competency and intelligence"
"Sunway Debate Open 2024","1","Novice Finals","THO &quot;settling&quot;"
"Sunway Debate Open 2024","2","Novice Pre-Finals","THP a world where isolated communities (e.g., rural populations, indigenous tribes) required every young person to explore different societies and cultures upon turning 18 years old"
"Sunway Debate Open 2024","3","Grand Final","TH opposes the belief that states should always pursue democracy"
"Sunway Debate Open 2024","4","Semifinals","THP a world where religions did not place emphasis on central historical figures (e.g., Prophet Muhammad in Islam, Jesus Christ in Christianity)"
"Sunway Debate Open 2024","5","Round 4","In developing countries where local languages are the main medium of communication, THBT schools should use a global language (e.g. English, Mandarin) as the primary medium of instruction."
"Sunway Debate Open 2024","6","Round 3","TH, as an up-and-coming young game designer, W rather work in an indie studio rather than a triple A studio"
"Sunway Debate Open 2024","7","Round 2","THW abolish the Olympic Games"
"Sunway Debate Open 2024","8","Round 1","THP a world where personal automobiles (e.g. cars, motorcycles) had never been invented."
"Sunway Pre-Nationals 2023","1","Novice Finals","THP a world where constitutions were exclusively written by an independent technocratic committee."
"Sunway Pre-Nationals 2023","2","Grand Final","THBT the scientists should destroy the evidence rather than sharing it to the world"
"Sunway Pre-Nationals 2023","3","Semifinals","THBT the environmental movement should prioritize advocating for anti-consumerism rather than green products"
"Sunway Pre-Nationals 2023","4","Quarterfinals","THS BRICS countries creating alternatives to the current international economic institutions (i.e. the IMF, the World Bank, and the World Trade Organisation)"
"Sunway Pre-Nationals 2023","5","Round 5","In illiberal democracies, THS opposition parties using tactics of disinformation and fearmongering against the established regime"
"Sunway Pre-Nationals 2023","6","Round 4","THW allow companies to buy the rights to govern economically failing cities as charter cities"
"Sunway Pre-Nationals 2023","7","Round 3","THR the Authors Guild lawsuit against OpenAI"
"Sunway Pre-Nationals 2023","8","Round 2","TH, as leaders of marginalised minority groups, would urge their respective communities to partake in greater social integration at the expense of sustaining unique cultural attributes"
"Sunway Pre-Nationals 2023","9","Round 1","THS the decline of filial piety"
"Surabaya Open 2023","1","Grand Final","TH Supports NALURI"
"Surabaya Open 2023","2","Semifinals","THW conduct referendums amongst members of the armed forces before initiating a war"
"Surabaya Open 2023","3","Pre-Semifinals","As a parent of a Neurodivergent child, This House would emphasise and celebrate their differences, rather than their similarities with Neurotypicals"
"Surabaya Open 2023","4","Round 4","THP a world where every couple uses FADE to see the expiration date of their relationship"
"Surabaya Open 2023","5","Round 3","THBT it is in the best interest of Indonesia for PDIP to actively continue its coalition with Gerindra for the 2024 General Elections"
"Surabaya Open 2023","6","Round 2","As an up and coming artist/writer, This House opposes the &quot;Chosen One&quot; trope in popular culture"
"Surabaya Open 2023","7","Round 1","In cases involving allegations of domestic violence, THW ban out-of-court settlements"
"Swan IV 2023","1","Grand Finals","THW deport Paddington Bear"
"Swan IV 2023","2","Round 3","THBT the government should incentivise &quot;unretirement&quot;"
"Swan IV 2023","3","Round 2","THW create a women-only state"
"Swan IV 2023","4","Round 1","THW weight votes towards younger individuals"
"Sydney AWGMDC 2023","1","Open Grand Final","THBT the parents of Lulu and Nana should publicly come forward"
"Sydney AWGMDC 2023","2","Open Semi Finals","THP a world where the ICN was not founded"
